{
  "$schema"     : "../symplectic-schema.json",
  "name"        : "KahanLi8",
  "description" : "KahanLi8 drift/kick composition, pinned from OrdinaryDiffEqSymplecticRK.",
  "kind"        : "symplectic-composition",
  "order"       : 8,
  "a"           : ["0.13020248308889008087881763", "0.56116298177510838456196441", "-0.3894749626448472864080786", "0.15884190655515560089621075", "-0.39590389413323757733623154", "0.18453964097831570709183254", "0.25837438768632204729397911", "0.29501172360931029887096624", "-0.60550853383003451169892108", "0.29501172360931029887096624", "0.25837438768632204729397911", "0.18453964097831570709183254", "-0.39590389413323757733623154", "0.15884190655515560089621075", "-0.3894749626448472864080786", "0.56116298177510838456196441", "0.13020248308889008087881763", "0.0"],
  "b"           : ["0.06510124154444503", "0.3456827324319992", "0.08584400956513055", "-0.11531652804484584", "-0.11853099378904099", "-0.10568212657746093", "0.22145701433231887", "0.27669305564781616", "-0.15524840511036214", "-0.15524840511036214", "0.27669305564781616", "0.22145701433231887", "-0.10568212657746093", "-0.11853099378904099", "-0.11531652804484584", "0.08584400956513055", "0.3456827324319992", "0.06510124154444503"]
}
