{
  "$schema"     : "../symplectic-schema.json",
  "name"        : "CandyRoz4",
  "description" : "CandyRoz4 drift/kick composition, pinned from OrdinaryDiffEqSymplecticRK.",
  "kind"        : "symplectic-composition",
  "order"       : 4,
  "a"           : ["0.6756035959798289", "-0.17560359597982886", "-0.17560359597982886", "0.6756035959798289"],
  "b"           : ["0.0", "1.3512071919596578", "-1.7024143839193155", "1.3512071919596578"]
}
