{
  "$schema"     : "../symplectic-schema.json",
  "name"        : "SofSpa10",
  "description" : "SofSpa10 drift/kick composition, pinned from OrdinaryDiffEqSymplecticRK.",
  "kind"        : "symplectic-composition",
  "order"       : 10,
  "a"           : ["0.07879572252168641926390768", "0.31309610341510852776481247", "0.02791838323507806610952027", "-0.2295928415939070941512134", "0.13096206107716486317465686", "-0.26973340565451071434460973", "0.07497334315589143566613711", "0.11199342399981020488957508", "0.36613344954622675119314812", "-0.39910563013603589787862981", "0.10308739852747107731580277", "0.41143087395589023782070412", "-0.00486636058313526176219566", "-0.39203335370863990644808194", "0.0519425029624496470371829", "0.05066509075992449633587434", "0.0496743706397298790545688", "0.04931773575959453791768001", "0.0496743706397298790545688", "0.05066509075992449633587434", "0.0519425029624496470371829", "-0.39203335370863990644808194", "-0.00486636058313526176219566", "0.41143087395589023782070412", "0.10308739852747107731580277", "-0.39910563013603589787862981", "0.36613344954622675119314812", "0.11199342399981020488957508", "0.07497334315589143566613711", "-0.26973340565451071434460973", "0.13096206107716486317465686", "-0.2295928415939070941512134", "0.02791838323507806610952027", "0.31309610341510852776481247", "0.07879572252168641926390768", "0.0"],
  "b"           : ["0.03939786126084321", "0.19594591296839747", "0.1705072433250933", "-0.10083722917941451", "-0.0493153902583711", "-0.06938567228867291", "-0.09738003124930963", "0.09348338357785083", "0.23906343677301847", "-0.016486090294904582", "-0.14800911580428242", "0.2572591362416807", "0.20328225668637748", "-0.1984498571458876", "-0.17004542537309514", "0.05130379686118707", "0.050169730699827185", "0.0494960531996622", "0.0494960531996622", "0.050169730699827185", "0.05130379686118707", "-0.17004542537309514", "-0.1984498571458876", "0.20328225668637748", "0.2572591362416807", "-0.14800911580428242", "-0.016486090294904582", "0.23906343677301847", "0.09348338357785083", "-0.09738003124930963", "-0.06938567228867291", "-0.0493153902583711", "-0.10083722917941451", "0.1705072433250933", "0.19594591296839747", "0.03939786126084321"]
}
